{
  "schema_version": "chemclaw.rewrite-brief.v1",
  "target_platform": "xiaohongshu",
  "content_type": "image_text",
  "language": "zh-CN",
  "audience": "采购与配方工程师",
  "communication_goal": "介绍产品规格与常见应用，邀请索取资料",
  "immutable_facts": {
    "product_name": "对羟基苯甲酸甲酯",
    "cas": "99-76-3",
    "grade": "工业级",
    "purity": "99.5%",
    "packaging": "25kg/袋",
    "application_facts": ["用于防腐体系评估场景（用户原文）"],
    "numeric_claims": ["99.5%", "25kg/袋"],
    "certifications": []
  },
  "claims_allowed": ["介绍规格与包装", "说明可提供资料"],
  "claims_needing_evidence": [],
  "prohibited_inferences": ["编造认证", "编造客户案例", "宣称绝对安全"],
  "unknown_fields": ["认证", "检测报告", "价格", "交期"],
  "must_keep": ["对羟基苯甲酸甲酯", "99-76-3", "99.5%", "25kg/袋"],
  "must_remove": [],
  "user_forbidden_terms": []
}
